{
  "schema_version": "p15-v7-attempt-007-sealed-catalog-receipt-v1",
  "attempt_id": "p15-v7-attempt-007",
  "contract_projection_sha256": "16d13a350fa8a20789709926fd6206228226f6fdcb8efc5e7f645a5449b093b0",
  "source_capture_sha256": "c7ec58c12b3acafe8f3bd92598e28e51b47c8b70680e2719a722be5c2ae251db",
  "storage_mode": "append_only",
  "sealed": true,
  "sealed_at_utc": "2026-08-02T07:52:40Z",
  "passes": [
    {
      "canonical_projection_sha256": "ceb858e0eba1b5ba311586478b20e9aadfa01a5d4001a81bbf9fc2c86d2af2af",
      "pages": [
        {
          "page": 1,
          "request": {
            "attempt_count": 1,
            "endpoint": "https://api.github.com/search/repositories",
            "headers": {
              "Accept": "application/vnd.github+json",
              "X-GitHub-Api-Version": "2022-11-28"
            },
            "issued_at_utc": "2026-08-02T07:26:06Z",
            "method": "GET",
            "params": {
              "order": "asc",
              "page": 1,
              "per_page": 100,
              "q": "language:Python is:public created:2026-07-05T07:00:00Z..2026-07-05T07:04:59Z",
              "sort": "updated"
            },
            "projection_sha256": "cb043d59ce2c634d71d89fac0290c6a207ed4ae7ce35dbfd34c4b94d761263ea"
          },
          "response": {
            "headers": {
              "Date": "Sun, 02 Aug 2026 07:26:10 GMT",
              "etag": null,
              "etag_present": false
            },
            "incomplete_results": false,
            "items": [
              {
                "default_branch": "main",
                "language": "Python",
                "owner": "seeyouqiuqiqu",
                "provider": "github",
                "repository": "knowledge_forge",
                "updated_at": "2026-07-05T07:14:56Z",
                "visibility": "public"
              },
              {
                "default_branch": "main",
                "language": "Python",
                "owner": "healerHK",
                "provider": "github",
                "repository": "ResearchAI",
                "updated_at": "2026-07-24T14:50:30Z",
                "visibility": "public"
              },
              {
                "default_branch": "main",
                "language": "Python",
                "owner": "keerthana-b-v",
                "provider": "github",
                "repository": "yugmai",
                "updated_at": "2026-07-05T07:01:41Z",
                "visibility": "public"
              },
              {
                "default_branch": "main",
                "language": "Python",
                "owner": "RaayaSP",
                "provider": "github",
                "repository": "Computer-price",
                "updated_at": "2026-07-05T07:01:56Z",
                "visibility": "public"
              },
              {
                "default_branch": "main",
                "language": "Python",
                "owner": "yuvrajkaurav28",
                "provider": "github",
                "repository": "JobPilot-AI",
                "updated_at": "2026-07-05T07:02:08Z",
                "visibility": "public"
              },
              {
                "default_branch": "main",
                "language": "Python",
                "owner": "varshithapidugu",
                "provider": "github",
                "repository": "Basic-Chatbot.py",
                "updated_at": "2026-07-05T07:02:16Z",
                "visibility": "public"
              },
              {
                "default_branch": "main",
                "language": "Python",
                "owner": "rushithareddy05",
                "provider": "github",
                "repository": "Major-Project",
                "updated_at": "2026-07-05T07:02:20Z",
                "visibility": "public"
              },
              {
                "default_branch": "master",
                "language": "Python",
                "owner": "lingqiqi854-star",
                "provider": "github",
                "repository": "astrbot_plugin_starlinememory",
                "updated_at": "2026-07-05T07:02:47Z",
                "visibility": "public"
              },
              {
                "default_branch": "main",
                "language": "Python",
                "owner": "cymarlboro",
                "provider": "github",
                "repository": "mainstream-gridded-products-data-processing",
                "updated_at": "2026-07-05T07:05:20Z",
                "visibility": "public"
              },
              {
                "default_branch": "main",
                "language": "Python",
                "owner": "jr5530",
                "provider": "github",
                "repository": "exercises",
                "updated_at": "2026-07-05T07:02:50Z",
                "visibility": "public"
              },
              {
                "default_branch": "main",
                "language": "Python",
                "owner": "tarikk786786",
                "provider": "github",
                "repository": "agentic-gpt-researcher",
                "updated_at": "2026-07-05T07:03:04Z",
                "visibility": "public"
              },
              {
                "default_branch": "main",
                "language": "Python",
                "owner": "tjgit2026",
                "provider": "github",
                "repository": "Age-Counter",
                "updated_at": "2026-07-05T07:03:18Z",
                "visibility": "public"
              },
              {
                "default_branch": "main",
                "language": "Python",
                "owner": "Pavan0760",
                "provider": "github",
                "repository": "Loan-Default-Risk-Predictor",
                "updated_at": "2026-07-05T07:03:28Z",
                "visibility": "public"
              },
              {
                "default_branch": "main",
                "language": "Python",
                "owner": "Zibuyu111",
                "provider": "github",
                "repository": "NetEase_music_lyrics",
                "updated_at": "2026-07-05T07:03:32Z",
                "visibility": "public"
              },
              {
                "default_branch": "main",
                "language": "Python",
                "owner": "Issho-lin",
                "provider": "github",
                "repository": "agent-platform",
                "updated_at": "2026-07-05T07:03:59Z",
                "visibility": "public"
              },
              {
                "default_branch": "master",
                "language": "Python",
                "owner": "backstract-apps",
                "provider": "github",
                "repository": "jovial-bhabha-3e296ff238",
                "updated_at": "2026-07-05T07:04:00Z",
                "visibility": "public"
              },
              {
                "default_branch": "master",
                "language": "Python",
                "owner": "King-dot935",
                "provider": "github",
                "repository": "llm-api-test",
                "updated_at": "2026-07-05T07:04:09Z",
                "visibility": "public"
              },
              {
                "default_branch": "main",
                "language": "Python",
                "owner": "soybean82-netizen",
                "provider": "github",
                "repository": "Restaurant",
                "updated_at": "2026-07-05T07:04:14Z",
                "visibility": "public"
              },
              {
                "default_branch": "main",
                "language": "Python",
                "owner": "KALYAN-2006",
                "provider": "github",
                "repository": "HDI-predictor",
                "updated_at": "2026-07-05T07:04:19Z",
                "visibility": "public"
              },
              {
                "default_branch": "main",
                "language": "Python",
                "owner": "magnus-c",
                "provider": "github",
                "repository": "151-deeplearning",
                "updated_at": "2026-07-05T07:05:30Z",
                "visibility": "public"
              },
              {
                "default_branch": "main",
                "language": "Python",
                "owner": "fatimaattaria1981-a11y",
                "provider": "github",
                "repository": "titanic-workshop-app",
                "updated_at": "2026-07-05T07:05:00Z",
                "visibility": "public"
              },
              {
                "default_branch": "main",
                "language": "Python",
                "owner": "ruproshanjha",
                "provider": "github",
                "repository": "Bank-Management",
                "updated_at": "2026-07-05T07:05:03Z",
                "visibility": "public"
              },
              {
                "default_branch": "main",
                "language": "Python",
                "owner": "Benjaminjacob443",
                "provider": "github",
                "repository": "alina-voice-assistant",
                "updated_at": "2026-07-05T07:07:19Z",
                "visibility": "public"
              },
              {
                "default_branch": "main",
                "language": "Python",
                "owner": "ganashree03",
                "provider": "github",
                "repository": "Ai-based-admission-predictor-and-college-recommendation",
                "updated_at": "2026-07-05T07:05:08Z",
                "visibility": "public"
              },
              {
                "default_branch": "main",
                "language": "Python",
                "owner": "aniketpatel786078-a11y",
                "provider": "github",
                "repository": "Ace-OS-Navigator",
                "updated_at": "2026-07-05T07:05:15Z",
                "visibility": "public"
              },